{
  "profile": "agent-run/1.0-candidate.1",
  "run_id": "urn:uuid:0190a007-0000-7000-8000-000000000401",
  "principal_id": "urn:uuid:0190a007-0000-7000-8000-000000000101",
  "context_pack_id": "context-pack:sha256:bb4c48f2c8fde586beff62d504a036bbb1f0e4224ee9b82d746c870a369b3d70",
  "base_workspace_revision": "wrev:sha256:aaaaaaaaaaaaaaaaaaaaaaaaaaaaaaaaaaaaaaaaaaaaaaaaaaaaaaaaaaaaaaaa",
  "mode": "patch",
  "model_binding": {
    "provider": "replaceable-provider",
    "model": "replaceable-model",
    "runtime": "local-agent-runtime/1",
    "model_revision": null,
    "binding_is_identity_authority": false
  },
  "adapter_binding": {
    "adapter_id": "adapter:file-agent:legacy-eveglyph",
    "profile": "agent-adapter/1.0-candidate.1",
    "protocol_version": "legacy-eveglyph-v0.5"
  },
  "capability_grant_ids": [
    "urn:uuid:0190a007-0000-7000-8000-000000000201"
  ],
  "status": "completed",
  "started_at": "2026-08-25T06:33:00Z",
  "finished_at": "2026-08-25T06:33:10Z",
  "proposal_ids": [
    "urn:uuid:0190a007-0000-7000-8000-000000000501"
  ],
  "external_effect_ids": [],
  "diagnostics": [],
  "metadata": {
    "provider_model_can_change_without_changing_principal": true
  }
}
